id,type,name,description,target,belongs_to,pc,median_tau_score,ts_pc,sum_tau,Kang_Berch_Combined_Signature,Progerin_Signature,Serum_6hr_Signature_probeSet_summed2genes_before_LmFit,Serum_72hr_Signature_probeSet_summed2genes_before_LmFit,Serum_144hr_Signature_probeSet_summed2genes_before_LmFit,Serum_1hr_Signature_probeSet_summed2genes_before_LmFit,Serum_24hr_Signature_probeSet_summed2genes_before_LmFit
BRD-A09533288,CP,verapamil,"calcium channel blocker, L-type calcium channel blocker, dopamine receptor antagonist","CACNA1C, CACNA1D, CACNA1G, CACNA1S, CACNA1A, CACNA1B, CACNA1F, CACNA1I, CACNB1, CACNB2, CACNB3, CACNB4, CYP2C8, CYP2E1, CYP3A4, CYP3A5, CYP3A7, DRD2, KCNA10, KCNA7, KCNH2, KCNJ11, NALCN, SCN5A, SLC29A4, SLC6A4",,"0.00, 0.00",1.2,"0.84, 0.11",-44.88,-48.19,-93.43,20.38,1.2,22.5,57.63,-4.97
BRD-K84658672,CP,nateglinide,"insulin secretagogue, ATP-sensitive potassium channel antagonist, meglitinide, sulphonylurea receptor activator","ABCC8, KCNJ11, CYP3A4, INS, KCNJ10, PPARG",,"1.43, 0.00",6.59,"0.84, 0.27",-44.92,31.03,16.66,57.46,-33.74,-26.53,-96.39,6.59
BRD-K77008974,CP,WYE-354,mTOR inhibitor,MTOR,MTOR inhibitor,"5.71, 1.43",-6.26,"1.44, 0.57",-45.15,-6.26,-0.95,96.16,-46.21,8.93,-61.14,-35.68
BRD-K69840642,CP,ISOX,HDAC inhibitor,HDAC6,HDAC inhibitor,"10.00, 7.14",-5.74,"1.81, 0.60",-45.52,71.14,-5.74,62.82,98.41,-98.84,-83.27,-90.04
BRD-K28680267,CP,BRD-K28680267,CCK receptor antagonist,"CCKAR, GABRA1, GABRB2, GABRG2",,"0.00, 0.00",-2.62,"0.89, 0.26",-46.04,-2.62,-56.71,-20.65,20.34,0,30.11,-16.51
BRD-A95939040,CP,sertaconazole,"sterol demethylase inhibitor, cell wall synthesis inhibitor",,,"0.00, 0.00",-6.26,"0.74, 0.25",-46.09,-6.26,-51.76,-29.01,-15.18,1.06,53.67,1.39
BRD-A60197193,CP,amisulpride,dopamine receptor antagonist,"DRD2, DRD3, HTR2A, HTR7",,"3.17, 1.59",0.39,"0.55, 0.09",-46.1,-72.85,-29.95,-42.03,0.39,46.02,43.92,8.4
BRD-K14550461,CP,doxercalciferol,vitamin D receptor agonist,VDR,Vitamin D receptor agonist,"0.00, 0.00",4.55,"1.52, 0.33",-46.15,-13.13,-89.03,40.62,28.15,4.55,24.44,-41.75
BRD-K30197592,CP,5-methoxytryptamine,serotonin receptor agonist,"HTR2A, HTR6, HTR1B, HTR1D, HTR1E, HTR1F, HTR2C, HTR4, HTR7, TRPM8",,"0.00, 0.00",0,"1.44, 0.44",-46.39,-41.18,16.91,7.07,3.45,0,0,-32.64
BRD-K14965640,CP,ibuprofen,"cyclooxygenase inhibitor, NFkB pathway inhibitor","PTGS2, PTGS1, ASIC1, BCL2, CFTR, CYP2C8, FABP2, PLAT, PPARG, SLC5A8, THBD",,"0.00, 0.00",0,"0.76, 0.26",-46.56,-45.72,-12.73,0,0,1.83,1.97,8.09
BRD-K64245000,CP,GW-4064,FXR agonist,NR1H4,,"0.00, 0.00",-1.34,"0.41, 0.08",-46.58,7.06,-49.28,5.24,-0.99,-1.34,-4.01,-3.26
BRD-K35377380,CP,I-OMe-AG-538,inhibitor of insulin growth factor 1 receptor protein tyrosine kinase,,,"0.00, 0.00",-6.71,"1.02, 0.26",-46.72,-13.04,24.95,-6.71,-56.21,6.91,-8.62,6
BRD-A33711280,CP,metixene,acetylcholine receptor antagonist,"CHRM5, CHRM1, CHRM2, CHRM3, CHRM4",,"0.00, 0.00",-0.42,"0.91, 0.25",-46.87,-16.24,-61.14,-46.59,-0.42,0,25.84,51.68
BRD-K96354014,CP,nifedipine,"calcium channel blocker, L-type calcium channel blocker","CACNA1C, CACNA1D, CACNA1S, CACNA2D1, CACNA1F, CACNA1H, CACNB2, CALM1, CYP3A5, GLRA1, GLRA3, GLRB, KCNA1, KCNA5, NR1I2, TRPM3",,"2.86, 2.86",-0.74,"0.86, 0.28",-47.29,-48.6,-12.24,-73.39,1.76,3.98,81.94,-0.74
BRD-A31227688,CP,kynuramine,aryl hydrocarbon receptor activator,,,"1.43, 0.00",0,"0.94, 0.28",-47.47,-40.24,-48.29,-64.83,0,0,42.81,63.08
BRD-K90574421,CP,ipsapirone,serotonin receptor agonist,HTR1A,,"0.00, 0.00",4.35,"1.03, 0.32",-47.52,10.57,-50.15,-71.64,-5.93,45.43,19.85,4.35
BRD-A92630576,CP,trimebutine,"opioid receptor agonist, acetylcholine receptor antagonist, Sodium Channel  Blockers","CHRM1, CHRM2, CHRM3, CHRM4",,"0.00, 0.00",-0.25,"1.00, 0.30",-47.72,-28.56,11.13,7.14,-36.85,4.51,-0.25,-4.84
BRD-A84189516,CP,baccatin-III,paclitaxel precursor,,,"0.00, 0.00",0.7,"1.48, 0.32",-47.82,-63.27,15.15,2.75,9.41,-0.25,-12.31,0.7
BRD-K80639402,CP,SB-258585,serotonin receptor antagonist,HTR6,,"1.59, 0.00",-2.94,"0.99, 0.26",-47.89,1.38,5.27,4.09,-16.81,-3.42,-35.46,-2.94
BRD-A41555725,CP,chlortetracycline,protein synthesis inhibitor,,,"0.00, 0.00",2.18,"1.30, 0.49",-48.12,-30.77,-32.83,-29.24,11.4,9.58,21.56,2.18
BRD-K40624912,CP,ZM-39923,JAK inhibitor,"JAK1, JAK3",,"0.00, 0.00",-0.99,"1.75, 0.43",-48.34,42.04,-0.99,15.51,-13.36,0,-21.7,-69.84
BRD-A65615053,CP,zacopride,"serotonin receptor antagonist, serotonin receptor agonist","HTR3A, HTR4, HTR3B, HTR5A",,"0.00, 0.00",0,"0.26, 0.05",-48.58,-29.65,-29.99,-40.34,0,18.08,30.92,2.4
BRD-K67277431,CP,picotamide,"prostanoid receptor antagonist, thromboxane receptor antagonist, thromboxane synthase inhibitor","TBXA2R, TBXAS1",Thromboxane receptor antagonist,"0.00, 0.00",1.41,"0.80, 0.22",-48.72,-1.48,4.05,21.65,-0.7,4.4,1.41,-78.05
BRD-K68558722,CP,deracoxib,cyclooxygenase inhibitor,PTGS2,,"0.00, 0.00",0.39,"0.60, 0.18",-48.87,-4.55,-88,-29.8,0.39,27.89,15.49,29.71
BRD-K34034388,CP,GBR-12783,dopamine uptake inhibitor,,,"1.43, 1.43",6.73,"0.70, 0.15",-49.11,13.75,31.91,-53.01,6.73,-53.73,9.51,-4.27
BRD-A90799790,CP,isradipine,"calcium channel blocker, L-type calcium channel blocker","CACNA1C, CACNA1D, CACNA2D1, CACNA1F, CACNA1H, CACNA1S, CACNA2D2, CACNB2",,"0.00, 0.00",-0.04,"1.30, 0.35",-49.35,-12.02,16.62,-75.6,-8.76,-0.04,4.42,26.03
BRD-K61993165,CP,niacin,vitamin agonist,"HCAR2, HCAR3, ACHE, DGAT2, HCAR1, NNMT, PTGDR, QPRT",,"0.00, 0.00",12,"1.23, 0.31",-49.39,21.11,12.23,12,-68.46,15.69,-28.08,-13.88
BRD-K36395411,CP,SB-206553,"serotonin receptor antagonist, serotonin receptor partial agonist","HTR2B, HTR2C, HTR1A, HTR2A",,"1.59, 0.00",2.11,"1.20, 0.42",-49.57,-4.19,-19.46,11.69,-56.8,8.14,2.11,8.94
BRD-A85472596,CP,L-670596,prostanoid receptor antagonist,,,"0.00, 0.00",-1.06,"1.40, 0.35",-49.57,4.24,16.79,-10.49,-22.18,-1.06,-65.58,28.71
BRD-K80738081,CP,resveratrol,"apolipoprotein expression enhancer, beta-secretase inhibitor, cyclooxygenase inhibitor, cytochrome P450 inhibitor, lipid peroxidase inhibitor, MAP kinase inhibitor, monoamine oxidase inhibitor, NFkB pathway modulator, SIRT activator, SIRT pathway, SIRT stimulant, sodium channel blocker, thioredoxin reductase inhibitor, topoisomerase inhibitor, xanthine oxidase inhibitor","PTGS1, PTGS2, SIRT1, APOA1, BACE1, CSNK2A1, MAOA, NQO2, SCN5A, TXNRD1, TXNRD2, XDH",,"0.00, 0.00",-4.83,"0.95, 0.20",-49.63,-11.83,-61,-4.83,-5.12,3.7,30.19,-0.74
BRD-K62353524,CP,DY-131,estrogen-related receptor agonist,"ESR2, ESRRB, ESRRG",,"0.00, 0.00",-17.57,"0.70, 0.22",-49.9,-19.08,3.24,-46.27,-17.57,48.64,-20.09,1.23
BRD-K05901394,CP,terguride,"adrenergic receptor antagonist, dopamine autoreceptor agonist, dopamine receptor agonist, dopamine receptor partial agonist, platelet aggregation inhibitor, prolactin secretion inhibitor, serotonin receptor antagonist","DRD2, HTR2A, HTR2B, ADRA1A, ADRA2A, ADRA2B, ADRA2C, DRD3, DRD4, HTR1A, HTR1B, HTR1D, HTR2C, PRL",,"0.00, 0.00",-5.88,"1.16, 0.42",-49.92,-49.67,-44.64,31.85,1.8,25.14,-8.52,-5.88
BRD-A80151636,CP,bromocriptine,"dopamine receptor agonist, dopamine receptor antagonist, prolactin secretion inhibitor","DRD2, ADRA2A, ADRA2B, ADRA2C, DRD1, DRD3, DRD4, DRD5, HTR1A, HTR1B, HTR1D, HTR2A, HTR2B, HTR2C, ADRA1A, ADRA1B, ADRA1D, HTR6, HTR7, PRL",,"0.00, 0.00",0.41,"0.98, 0.35",-49.97,-20.66,-59.97,2.64,6.45,0.25,20.91,0.41
BRD-A64479082,CP,quinidine,"cytochrome P450 inhibitor, P glycoprotein inhibitor, sodium current blocker","SCN5A, ABCB1, CYP2D6, KCNA5, KCNA7, KCNH1, KCNH2, KCNH5, KCNK1, KCNK6, SLC29A4",Sodium channel blocker,"1.59, 1.59",2.54,"1.06, 0.36",-50.05,4.25,-6.63,42.01,-42.64,33.52,2.54,-83.1
BRD-A55913614,CP,primaquine,"antimalarial agent, DNA inhibitor","KRT7, NQO2",,"0.00, 0.00",0.6,"0.57, 0.14",-50.62,13.02,70.54,-69.68,0.6,-12.48,-62.62,10
BRD-K46142322,CP,RS-67333,serotonin receptor partial agonist,HTR4,,"0.00, 0.00",3.49,"1.17, 0.35",-50.67,-77.68,-57.6,23.69,3.49,38.25,26.68,-7.5
BRD-A55484088,CP,BNTX,opioid receptor antagonist,"OPRD1, OPRK1, OPRM1",,"1.59, 1.59",4.47,"2.36, 0.59",-50.69,84.13,4.47,-91.72,82.14,-88.83,-86.58,45.7
BRD-K18250272,CP,propoxycaine,anesthetic,,,"0.00, 0.00",-7.96,"0.56, 0.15",-50.71,-7.96,-48.4,-25.31,12.39,27.77,18.84,-28.04
BRD-A63346720,CP,rimcazole,"sigma receptor antagonist, dopamine reuptake inhibitor",SIGMAR1,,"0.00, 0.00",6.78,"1.45, 0.64",-50.71,6.78,24.14,57.64,28.71,-44.78,-77.96,-45.24
BRD-K63923597,CP,barasertib,"Aurora kinase inhibitor, mitotic inhibitor, protein kinase inhibitor","AURKB, AURKC",Aurora kinase inhibitor,"0.00, 0.00",-0.46,"0.64, 0.41",-50.91,-0.46,-38.54,32.28,17.84,3.03,-56.61,-8.45
BRD-K30064966,CP,BRD-K30064966,caspase activator,CASP3,,"1.43, 0.00",-6.11,"0.91, 0.28",-50.97,-6.11,-5.61,-92.95,-41.87,-28.73,38.13,86.17
BRD-K93080877,CP,Ala-Ala-Phe-CMK,tripeptidyl peptidase inhibitor,TPP2,,"4.76, 1.59",-3.86,"1.13, 0.43",-50.99,72.55,0.63,-88.27,18.46,-10.51,-39.99,-3.86
BRD-K59419204,CP,AM-281,"cannabinoid receptor antagonist, cannabinoid receptor inhibitor","CNR1, CNR2, GPR55",,"0.00, 0.00",6.69,"0.94, 0.30",-50.99,19.68,6.69,-80.82,23.04,-17.49,-21.1,19.01
BRD-K00486786,CP,RO-08-2750,"nerve growth factor receptor ligand, NGF binding inhibitor","NGFR, NGF",,"0.00, 0.00",2.61,"1.11, 0.30",-51.07,37.68,10.65,-94.81,0.56,2.61,-31.27,23.51
BRD-K59222562,CP,BRD-K59222562,"CLK inhibitor, dual specificity tyrosine-(Y)-phosphorylation regulated kinase inhibitor, dual-specificity tyrosine-(Y)-phosphorylation regulated kinase 1B inhibitor","CLK1, CLK4, DYRK1A, DYRK1B",,"3.17, 3.17",0,"1.36, 0.33",-51.11,-74.45,-93.15,0,-46.35,84.91,65.67,12.26
BRD-K76205745,CP,losartan,angiotensin receptor antagonist,AGTR1,,"0.00, 0.00",-20.93,"0.31, 0.02",-51.11,-3.1,-29.16,-31.15,-3.88,81.17,-44.06,-20.93
BRD-A16665823,CP,butoconazole,"cell wall synthesis inhibitor, sterol demethylase inhibitor",,,"1.43, 1.43",-37.59,"0.58, 0.18",-51.21,-54.43,-7.96,-37.59,-43.37,-47.02,91.01,48.15
BRD-K41859756,CP,NVP-AUY922,HSP inhibitor,"HSP90AA1, HSP90AA2, HSP90AB1",HSP inhibitor,"1.43, 1.43",-33.79,"1.22, 0.41",-51.23,-51.89,19.86,90.4,86.86,-33.79,-81.5,-81.17
BRD-K34170797,CP,fexaramine,FXR agonist,NR1H4,,"0.00, 0.00",0,"1.27, 0.36",-51.46,-28.34,-29.44,-13.51,0,8.69,11.14,0
BRD-K95808480,CP,taxifolin,"apolipoprotein secretion inhibitor, beta amyloid aggregation inhibitor, cholesterol biosynthesis inhibitor, HMGCR inhibitor, NFkB pathway modulator, opioid receptor antagonist, reverse transcriptase inhibitor","APOB, APP, HMGCR",,"0.00, 0.00",-5.14,"1.88, 0.76",-51.57,5.96,15.89,10.74,-7.26,-44.17,-5.14,-27.59
BRD-K64310881,CP,MW-STK33-3B,large conductance potassium channel activator,,,"1.59, 0.00",-3.32,"1.39, 0.25",-51.57,-29.06,-21.28,-40,20.02,6.57,15.5,-3.32
BRD-K54095730,CP,CMPD-1,p38 MAPK inhibitor,"GNRHR, MAPK14",,"1.59, 0.00",0,"2.41, 0.70",-51.66,29,-1.47,-95,15.81,0,-7.76,7.76
BRD-K64157027,CP,ZD-2079,"adrenergic receptor agonist, insulin sensitizer",ADRB3,,"0.00, 0.00",-25.87,"1.17, 0.34",-52.01,23.97,37.75,26.61,-25.87,-33.76,-54.76,-25.95
BRD-K26657438,CP,imiquimod,"interferon inducer, toll-like receptor agonist, immunostimulant","TLR7, TLR8",,"0.00, 0.00",-10.04,"1.31, 0.49",-52.15,-21.63,-10.04,21.58,-35.45,15.57,-3.42,-18.76
BRD-K88741031,CP,"methyl-2,5-dihydroxycinnamate","EGFR inhibitor, tyrosine kinase inhibitor",EGFR,,"0.00, 0.00",-1.44,"1.06, 0.33",-52.25,-27.1,-41.64,-51.17,-1.2,17.44,52.86,-1.44
BRD-K92984783,CP,melperone,"dopamine receptor antagonist, serotonin receptor antagonist","DRD2, HTR1A, HTR2A",,"0.00, 0.00",1.66,"0.91, 0.20",-52.41,-3.43,-95.04,-15.56,25.22,1.66,32.84,1.9
BRD-K46742498,CP,alosetron,serotonin receptor antagonist,HTR3A,,"0.00, 0.00",4.76,"1.31, 0.35",-52.52,-34.44,-58.02,-3.03,14.13,8.14,4.76,15.94
BRD-A72066420,CP,mifobate,"cholesterol inhibitor, PPAR receptor antagonist, renin inhibitor","PPARG, REN",,"0.00, 0.00",-5.01,"1.33, 0.49",-52.57,-19.01,-5.01,16.5,3.51,-18.49,-35.3,5.23
BRD-A02713983,CP,dihydrodeoxygedunin,growth factor receptor activator,NTRK2,,"0.00, 0.00",1.2,"1.14, 0.33",-52.82,7.43,12.9,11.22,1.2,-22.41,-18.79,-44.37
BRD-K28115081,CP,apafant,platelet activating factor receptor antagonist,PTAFR,,"1.43, 1.43",0.99,"1.13, 0.28",-52.86,-90.13,27.2,-28.07,17.64,0.99,20.71,-1.2
BRD-K10177585,CP,PSB-11,adenosine receptor antagonist,"ADORA3, ADORA1, ADORA2A",,"1.43, 0.00",-1.69,"1.27, 0.49",-52.96,7.26,-27.33,7.97,7.72,-1.69,-30.02,-16.87
BRD-A43082555,CP,loxoprofen,"cyclooxygenase inhibitor, platelet aggregation inhibitor, prostanoid receptor inhibitor",PTGS2,,"0.00, 0.00",-35.78,"0.88, 0.30",-53.36,45.2,6.24,-35.78,-45,61.91,-45.14,-40.79
BRD-A62184259,CP,cycloheximide,"glycogen synthase kinase inhibitor, protein synthesis inhibitor","GSK3B, RPL3",Protein synthesis inhibitor,"1.43, 0.00",-18.31,"2.40, 0.60",-53.43,90.73,-18.31,-69.62,93.16,14.03,-96.98,-66.44
BRD-A38030642,CP,cyclosporin-a,"calcineurin inhibitor, cyclophilin inhibitor, immunosuppressant, insulin expression inhibitor, T cell inhibitor","PPIA, ABCB11, CAMLG, CYP3A5, CYP3A7, FPR1, PPID, PPIF, PPP3CA, PPP3R2, SLC10A1, SLCO1B1, SLCO1B3",,"0.00, 0.00",6.67,"2.28, 0.90",-53.53,33.15,6.67,44.58,68.24,-58.93,-87.66,-59.58
BRD-K16618170,CP,BRD-K16618170,lysophospholipid receptor agonist,S1PR4,,"1.59, 1.59",30.77,"1.07, 0.24",-53.58,-61.56,-90.31,-75.58,38.79,35.7,68.61,30.77
BRD-K47983010,CP,BX-795,"IKK inhibitor, PDK1 inhibitor, phosphoinositide dependent kinase inhibitor, serine/threonine kinase inhibitor, TBK1 inhibitor","PDPK1, CDK2, CHEK1, GSK3B, IKBKE, KDR, PDK1, TBK1",IKK inhibitor,"0.00, 0.00",-18.86,"2.16, 0.44",-53.64,79.66,63.99,-1.93,-18.86,-80.9,-75.1,-20.5
BRD-K74284736,CP,L-689560,glutamate receptor antagonist,"GRIN1, GRIN2A, GRIN2B, GRIN2C, GRIN2D",,"1.43, 0.00",-2.5,"1.13, 0.25",-53.64,-72.64,-86.77,17.39,-2.5,38.17,56.59,-3.88
BRD-M47937986,CP,cefatrizine,cell wall synthesis inhibitor,,,"0.00, 0.00",-8,"0.83, 0.25",-53.65,-42.28,-74.68,-12.97,-8,38.17,36,10.11
BRD-K53878242,CP,MMPX,phosphodiesterase inhibitor,,,"0.00, 0.00",-1.73,"0.97, 0.36",-53.67,-1.73,-35.35,-11.26,-9.77,4.44,0,0
BRD-K37720887,CP,SB-525334,TGF beta receptor inhibitor,TGFBR1,TGF beta receptor inhibitor,"2.86, 2.86",-17.33,"1.60, 0.44",-53.68,-76.75,-42.82,-17.33,32.16,44.74,70.42,-64.1
BRD-K16977723,CP,PP-3,EGFR kinase inhibitor,,,"1.43, 0.00",-7.84,"0.85, 0.35",-53.74,-21.13,-35.53,-7.84,-1.9,26.8,-2.64,-11.5
BRD-K06024458,CP,n-arachidonyl-GABA,arachidonyl amino acid that inhibits pain,,,"0.00, 0.00",15.01,"1.06, 0.38",-53.83,-69.87,-81.63,-14.14,19.4,15.01,55.92,21.48
BRD-K07117950,CP,imperatorin,"acetylcholinesterase inhibitor, nitric oxide production inhibitor, Sodium Channel  Blockers","ACHE, HTR7",,"1.43, 0.00",-14.55,"0.82, 0.20",-53.84,-17.82,-67.83,-14.55,-1.65,28.05,36.48,-16.52
BRD-K82823804,CP,SA-792987,PKC inhibitor,WEE1,PKC inhibitor,"0.00, 0.00",15.19,"1.32, 0.30",-53.9,63.7,15.19,68.69,25.91,-60.26,-77.56,-89.57
BRD-A38747044,CP,KU-14R,pancreatic -cell I3 binding site antagonist,,,"0.00, 0.00",0,"0.89, 0.27",-54.03,1.3,-17.96,12.81,0,1.34,-14.67,-36.85
BRD-K29582677,CP,flunarizine,"calcium channel blocker, T-type calcium channel blocker","CACNA1G, CACNA1H, CACNA1I, CALM1, CYP2J2, HRH1",,"0.00, 0.00",-20.42,"0.92, 0.23",-54.07,-33.8,-26.3,-9.27,-21.95,21.5,36.17,-20.42
BRD-K71731651,CP,PNU-120596,"acetylcholine receptor modulator, acetylcholine receptor positive allosteric modulator",CHRNA7,,"1.43, 1.43",0,"1.24, 0.47",-54.1,-18.16,-78.23,9.74,0,8.41,44.99,-20.85
BRD-K29668683,CP,BD-1063,sigma receptor antagonist,SIGMAR1,Sigma receptor antagonist,"0.00, 0.00",-21.77,"1.31, 0.28",-54.13,-21.77,19.77,-36.39,-27.13,-29.52,-15.31,56.22
BRD-K71035033,CP,masitinib,"KIT inhibitor, PDGFR tyrosine kinase receptor inhibitor, src inhibitor, c-kit inhibitor, FGFR antagonist, FGFR inhibitor, tyrosine kinase inhibitor","KIT, FGFR3, LYN, PDGFRA, PDGFRB",PDGFR/KIT inhibitor,"0.00, 0.00",-27.95,"0.80, 0.24",-54.2,32,-27.95,-49.23,75.3,-7.66,-29.07,-47.59
BRD-K63089472,CP,farnesylthioacetic-acid,inhibitor of methyl esterification of farnesylated proteins,,,"1.43, 1.43",0,"1.24, 0.35",-54.26,-51.14,-85.34,-16.05,2.61,28.46,67.2,0
BRD-A59808129,CP,guggulsterone,"estrogen receptor agonist, FXR antagonist, progesterone receptor agonist, cholesterol inhibitor, IKK inhibitor, PXR agonist","NR1H4, PGR, AR, ESR1, IKBKB, NR1I2, NR3C1, NR3C2",FXR antagonist,"0.00, 0.00",0,"1.39, 0.27",-54.35,-2.68,-77.51,-52.93,9.03,23.9,45.84,0
BRD-A26787626,CP,cyclopiazonic-acid,ATPase inhibitor,ATP2A1,,"0.00, 0.00",-12.45,"0.97, 0.17",-54.46,-41.81,-35.27,-63.23,23.49,-12.45,74.81,0
BRD-A50684349,CP,fenoldopam,dopamine receptor agonist,"DRD1, ADRA1A, ADRA1B, ADRA1D, ADRA2A, ADRA2B, ADRA2C, DRD4, DRD5",,"1.43, 1.43",0.46,"0.40, 0.10",-54.47,-28.52,-34.11,-73.62,0.46,51.29,4.72,25.31
BRD-A51829654,CP,BRL-15572,serotonin receptor antagonist,"HTR1D, HTR1A, HTR1B, HTR1E, HTR1F, HTR2A, HTR2B, HTR2C, HTR6",,"0.00, 0.00",-6.33,"1.05, 0.30",-54.5,-17.08,-46.67,-6.33,-0.46,22.34,11.34,-17.64
BRD-A62182663,CP,YK-4279,"apoptosis stimulant, binding of RNA helicase A to the transcription factor EWS-FLI1 inhibitor, EWS-FLI1 inhibitor","DHX9, EWSR1, FLI1",,"1.43, 0.00",-0.74,"1.40, 0.68",-54.53,-84.66,-33.57,-95.76,-0.74,48.64,52.89,58.67
BRD-K74501079,CP,azithromycin,"50S ribosomal subunit inhibitor, protein synthesis inhibitor",MLNR,,"0.00, 0.00",0,"1.00, 0.33",-54.56,8.17,11.35,59.16,0,-5.92,-82.6,-44.72
BRD-K06467078,CP,corynanthine,alpha adrenergic receptor antagonist,,,"0.00, 0.00",-10.74,"1.27, 0.38",-54.73,-20.54,-12.22,3.48,10.02,-0.8,-23.93,-10.74
BRD-A29260609,CP,acebutolol,adrenergic receptor antagonist,"ADRB1, ADRB2",,"1.59, 1.59",7.36,"1.13, 0.31",-54.76,-52.68,-76.62,-59.74,7.36,46.84,44.48,35.6
BRD-K17823458,CP,danoprevir,"HCV inhibitor, serine protease inhibitor",,,"2.86, 1.43",3.74,"0.92, 0.30",-54.77,-62.77,-78.32,-33.96,18.13,5.04,93.37,3.74
BRD-K96799727,CP,pifithrin-mu,HSP inhibitor,"HSPA1A, TP53",,"1.43, 0.00",-15.67,"1.05, 0.24",-54.91,48.76,71.48,-15.67,-50.87,0.25,-53.7,-55.16
BRD-K02404261,CP,caffeine,"adenosine receptor antagonist, ATM kinase inhibitor, ATR kinase inhibitor","ADORA1, ADORA2A, ADORA2B, ATM, ITPR1, RYR1, ADORA3, ATR, ITPR2, ITPR3, PDE10A, PDE11A, PDE1A, PDE1B, PDE1C, PDE2A, PDE3A, PDE3B, PDE4A, PDE4B, PDE4C, PDE4D, PDE5A, PDE6A, PDE6B, PDE6C, PDE7A, PDE7B, PDE8A, PDE8B, PDE9A, PIK3CA, PIK3CB, PIK3CD, PRKDC, RYR2, RYR3",,"0.00, 0.00",-9.35,"0.43, 0.13",-54.98,-18.34,-13.03,-9.35,7.52,-7.23,-1.3,-13.25
BRD-M86331534,CP,pyrvinium-pamoate,"AKT inhibitor, androgen receptor (AR) inhibitor, androgen receptor antagonist",AR,,"1.43, 1.43",15.42,"2.96, 0.81",-55.13,85.07,15.42,-81.42,50.47,-71.79,-92.57,39.69
BRD-K96862998,CP,pirfenidone,"FGFR antagonist, p38 MAPK inhibitor, TGF beta receptor antagonist, TGF beta receptor inhibitor, tumor necrosis factor production inhibitor, tumor necrosis factor receptor antagonist","TNF, FURIN, MAPK14, TNFRSF1A",,"0.00, 0.00",-11.44,"1.26, 0.27",-55.15,-32.82,-18.26,7.03,0,-11.44,24.89,-24.55
BRD-K02407574,CP,parbendazole,tubulin inhibitor,TUBB,Tubulin inhibitor,"0.00, 0.00",6.53,"0.89, 0.42",-55.25,-65.81,6.53,-98.66,-60.04,84.17,22.65,55.91
BRD-K48427617,CP,U-0124,MEK inhibitor,,,"0.00, 0.00",-5.57,"1.41, 0.60",-55.7,-45.83,-43.55,-68.56,-5.57,30.53,44.63,32.65
BRD-K14048378,CP,BRD-K14048378,lysophospholipid receptor agonist,S1PR3,,"0.00, 0.00",-14.51,"0.89, 0.23",-55.75,-14.66,-46.78,5.91,19.47,10.05,-15.23,-14.51
BRD-K93258693,CP,GW-9662,PPAR receptor antagonist,"PPARG, NCOA2, RXRA",,"0.00, 0.00",-19.35,"1.00, 0.25",-55.81,-34.33,-45.4,-33.06,-19.35,46.42,32.26,-2.35
BRD-K00662280,CP,CL-218872,GABA receptor agonist,"GABRA1, GABRA2, GABRA3, GABRA5, GABRB2, GABRG2",,"2.86, 1.43",-13.25,"1.31, 0.27",-55.98,-18.22,-15.72,38.18,-50.99,5.32,-13.25,-1.3
BRD-A41451487,CP,PK-11195,"benzodiazepine receptor antagonist, constitutive androstane receptor (CAR) antagonist, PXR agonist, translocator protein antagonist","TSPO, NR1I2, NR1I3",,"1.43, 0.00",-0.42,"0.45, 0.03",-56.35,-1.62,-21.59,-38.53,-0.02,-0.42,3.1,2.73
BRD-K59851896,CP,calycanthine,GABA release inhibitor,,,"0.00, 0.00",1.34,"0.83, 0.23",-56.38,-53.57,24.97,-73.08,-22.19,26.4,39.75,1.34
BRD-A79314293,CP,cephalosporanic-acid,core structure for synthesis of cephalosporin antibiotics,,,"4.76, 4.76",-6.99,"1.76, 0.66",-56.55,-10.84,-13.1,-6.99,0,22.21,20.92,-68.75
BRD-K68246049,CP,TTNPB,"RAR agonist, retinoid receptor agonist","RARB, RARA, RARG",Retinoid receptor agonist,"0.00, 0.00",-11.53,"1.40, 0.33",-56.56,-39.51,-42.66,-41.09,-11.53,42.94,34.06,1.23
BRD-A47829399,CP,artesunate,DNA synthesis inhibitor,,,"0.00, 0.00",-4.29,"1.72, 0.51",-56.61,-6.13,-4.29,0.95,0,-2.77,-30.53,-13.84
BRD-A20968261,CP,WAY-213613,glutamate transporter inhibitor,SLC1A2,,"1.43, 1.43",0,"0.76, 0.27",-56.72,-75.81,-23.63,-19.81,2.09,56.57,3.87,0
BRD-K33818169,CP,GW-3965,"LXR agonist, ABC transporter expression enhancer","NR1H2, NR1H3, ABCA1",,"1.43, 0.00",0.11,"0.90, 0.35",-56.88,14.81,18.43,-6.89,0.11,-55.1,18.44,-46.68
BRD-A10070317,CP,propranolol,adrenergic receptor antagonist,"ADRB2, ADRB3, ADRB1, CYP2C19, HTR1A, HTR1B",,"1.43, 1.43",0,"1.45, 0.47",-57.07,5.81,10.36,-4.83,0,-36.28,5,-37.13
BRD-A77299732,CP,salubrinal,"eukaryotic translation initiation factor inhibitor, GlyT-1 inhibitor","EIF2S1, SLC6A9",,"1.59, 1.59",-15.51,"1.56, 0.45",-57.07,-16.2,-30.25,-10.71,-29,-15.51,31.77,12.83
BRD-K87343924,CP,wortmannin,"PI3K inhibitor, ATM kinase inhibitor, ATR kinase inhibitor, DNA dependent protein kinase inhibitor, mTOR inhibitor, Phosphatidylinositol 3-kinase (PI3K) inhibitor, PLK inhibitor","PIK3CA, PIK3CG, PLK1, ATM, ATR, MTOR, PI4KA, PI4KB, PIK3CD, PIK3R1, PLK3, PRKDC",,"3.17, 1.59",-36.05,"1.68, 0.48",-57.12,54.24,32.28,89.76,-50.7,-61.53,-36.05,-85.12
BRD-A34255068,CP,rolipram,"phosphodiesterase inhibitor, interleukin receptor antagonist","PDE4A, PDE4B, PDE4D, PDE4C, PDE5A",,"0.00, 0.00",-1.59,"0.74, 0.10",-57.13,-36.27,-25.38,-17.66,-1.59,5.27,12.77,5.73
BRD-K95885906,CP,quercetagetin,Pim kinase inhibitor,PIM1,,"2.86, 2.86",-6.59,"0.70, 0.18",-57.13,-28.82,-9.97,-5.89,1.02,-16.89,10.01,-6.59
BRD-K45888792,CP,huperzine-a,"acetylcholinesterase inhibitor, glutamate receptor antagonist",ACHE,,"0.00, 0.00",-10.58,"1.68, 0.48",-57.14,-45.08,48.52,1.09,5.04,-32.68,-10.58,-23.45
BRD-K21672174,CP,RO-28-1675,glucokinase activator,GCK,,"0.00, 0.00",0,"0.66, 0.01",-57.15,0,6.6,7.5,87.76,-38.95,-85.1,-34.96
BRD-K78599730,CP,manumycin-a,"farnesyltransferase inhibitor, NFkB pathway inhibitor, ras farnesyltransferase inhibitor","FNTA, IKBKB",NFkB pathway inhibitor,"4.29, 1.43",-5.4,"2.32, 0.57",-57.48,93.44,36.06,-77.07,10.94,-23.98,-91.47,-5.4
BRD-K83010055,CP,VU-0415374-1,glutamate receptor modulator,GRM4,,"0.00, 0.00",-3.63,"1.07, 0.32",-57.66,-48.62,-23.83,-5.5,-3.31,27.23,0,-3.63
BRD-K63151507,CP,MNITMT,lymphocyte inhibitor,,,"0.00, 0.00",-1.87,"1.07, 0.26",-58.11,-66.15,-13.57,-25.85,-1.87,12.52,36.81,0
BRD-K08806317,CP,timolol,adrenergic receptor antagonist,"ADRB2, ADRB1",,"0.00, 0.00",10.52,"0.59, 0.10",-58.31,27.4,-91.23,-50.62,18.3,10.52,35.19,-7.87
BRD-K26979635,CP,NS-3694,glutamate receptor antagonist,GRIK1,,"0.00, 0.00",-11.12,"1.36, 0.32",-58.33,-45.82,-52.99,-25.9,-11.12,63.61,2.95,10.94
BRD-A52326238,CP,isogedunin,HSP inhibitor,,,"0.00, 0.00",-15.06,"1.13, 0.20",-58.47,15.02,-36.11,20.05,-16.43,0.71,-15.06,-26.65
BRD-K62221994,CP,T-98475,gonadotropin releasing factor hormone receptor antagonist,"GNRH1, GNRHR",,"4.29, 0.00",9,"1.59, 0.49",-58.52,43.53,9,74.48,45.08,-75.35,-69.14,-86.12
BRD-K04146668,CP,GW-441756,"growth factor receptor inhibitor, leucine rich repeat kinase inhibitor","LRRK2, NTRK1",,"0.00, 0.00",-13.69,"1.23, 0.33",-58.59,-13.69,-25.17,54.5,4.51,-1.13,-20.64,-56.97
BRD-K49519092,CP,immethridine,histamine receptor agonist,HRH3,,"1.43, 1.43",1.48,"0.53, 0.11",-58.65,-49.42,-69.07,-12.18,22.04,12.72,35.78,1.48
BRD-K41868777,CP,W-5,calmodulin antagonist,,,"3.17, 0.00",2.13,"1.07, 0.31",-58.65,-14.43,4.43,29.82,2.13,6.56,-10.84,-76.32
BRD-A65739223,CP,ramipril,angiotensin converting enzyme inhibitor,ACE,,"0.00, 0.00",-1.62,"1.52, 0.49",-58.74,-1.23,-1.62,5.93,-53.54,-6.44,4.3,-6.14
BRD-K70358946,CP,aripiprazole,"serotonin receptor agonist, serotonin receptor antagonist, dopamine receptor agonist, dopamine receptor partial agonist, serotonin receptor partial agonist","DRD2, HTR1A, HTR2A, HRH1, HTR1B, HTR1D, HTR2C, ADRA1A, ADRA1B, ADRA2A, ADRA2B, ADRA2C, CHRM1, CHRM2, CHRM3, CHRM4, CHRM5, DRD1, DRD3, DRD4, DRD5, HTR1E, HTR3A, HTR6, HTR7",,"0.00, 0.00",-7.49,"0.97, 0.19",-58.9,11.99,-15.04,43.28,0.14,-29.25,-7.49,-62.53
BRD-K18799075,CP,BAY-59-3074,cannabinoid receptor partial agonist,"CNR1, CNR2",Cannabinoid receptor agonist,"1.43, 1.43",-29.16,"0.63, 0.17",-58.99,51.04,-29.16,-49.68,-46.31,-43.78,40.36,18.54
BRD-K92678294,CP,irilin-a,isoflavone,,,"1.43, 1.43",-6.88,"0.70, 0.23",-59.01,9.51,-14.47,-36.05,1.41,-11.12,-6.88,-1.41
BRD-K60218670,CP,BRD-K60218670,lipoxygenase inhibitor,,,"0.00, 0.00",-2.4,"1.28, 0.23",-59.18,-25.52,-22.04,3.34,0,0,-12.56,-2.4
BRD-A21723284,CP,naltriben,opioid receptor antagonist,"OPRD1, OPRK1, OPRM1",,"1.43, 1.43",-5.35,"1.01, 0.31",-59.2,-5.35,-38.48,-25.55,-8.32,4.85,4.35,9.3
BRD-K13927029,CP,retinol,RAR receptor binder,"ALDH1A1, ALDH1A2, ALDH1A3, DHRS3, DHRS4, LRAT, NR2C2, RBP1, RBP3, RDH11, RDH12, RDH13, RDH14, RDH5, RDH8, RETSAT, RHO, RLBP1, RXRA, RXRB, RXRG",,"4.29, 1.43",-3.38,"1.06, 0.43",-59.22,-56.12,-9.44,65.75,-3.38,5.94,-59.86,-2.11
BRD-A77824596,CP,fluocinolone,"corticosteroid agonist, glucocorticoid receptor agonist","NR3C1, SERPINA6",,"1.59, 0.00",-6.08,"1.51, 0.42",-59.25,53.97,82.01,-64.53,26.23,-81.16,-69.69,-6.08
BRD-K23913458,CP,coumarin,vitamin antagonist,"CA1, CA12, CA14, CA2, CA4, CA6, CA9, CYP2A6",,"1.43, 0.00",-20.93,"0.68, 0.25",-59.6,-20.93,-63.41,-26.62,-24.39,54.38,41.97,-20.6
BRD-A34751532,CP,homosalate,HSP activator,,,"0.00, 0.00",-11.62,"0.73, 0.31",-59.72,-16.01,-52.05,-18.25,2.01,13.03,23.17,-11.62
BRD-K23566484,CP,nilutamide,"androgen receptor antagonist, RNA directed RNA polymerase inhibitor","AR, CYP2C19",,"0.00, 0.00",-5.6,"0.66, 0.20",-60.03,-1.02,-1.87,-21.05,-11.42,-1.02,-18.05,-5.6
